{
  "status": "UNKNOWN",
  "failure_code": "MCP_ACTION_PENDING",
  "message": "Dialog select did not update to 域名规则",
  "evidence": {
    "bridge_backend": "real_harmonyos_mcp_backend",
    "action": "wait_dialog_select",
    "params": {
      "index": 0,
      "expected_text": "域名规则"
    },
    "action_plan": {}
  }
}